campus,titulo,link,data,hora,tempo_leitura,resumo,imagem
Senhor do Bonfim,Processo Eleitoral para escolha dos membros do Comitê Gestor do Sistema de Bibliotecas do Instituto Federal Baiano (CGSIB),https://www.ifbaiano.edu.br/unidades/bonfim/2026/07/16/processo-eleitoral-para-escolha-dos-membros-do-comite-gestor-do-sistema-de-bibliotecas-do-instituto-federal-baiano-cgsib/,2026-07-16,22:34,1,"As inscrições serão realizadas de 21 a 28/07/2026 no site de Concursos e Seleções do IF Baiano, no link abaixo:",https://www.ifbaiano.edu.br/unidades/bonfim/files/2026/07/6825-CARD-COMITE-GESTOR.webp
Senhor do Bonfim,Chamada Pública N° 02 &#8211; Residência Estudantil 2026,https://www.ifbaiano.edu.br/unidades/bonfim/2026/07/15/chamada-publica-n-02-residencia-estudantil/,2026-07-15,16:42,1,,
Senhor do Bonfim,Edital PAISE 2026.2,https://www.ifbaiano.edu.br/unidades/bonfim/2026/07/08/edital-paise-2026-2/,2026-07-08,14:41,1,,https://www.ifbaiano.edu.br/unidades/bonfim/files/2026/07/2415-card-paise1.webp
Senhor do Bonfim,EDITAL INTERNO &#8211; PROCESSO SELETIVO PARA PREENCHIMENTO DE VAGA REMANESCENTE DE ESTÁGIO CURRICULAR – CURSO TÉCNICO EM INFORMÁTICA INTEGRADO AO ENSINO MÉDIO,https://www.ifbaiano.edu.br/unidades/bonfim/2026/05/27/edital-interno-processo-seletivo-para-preenchimento-de-vaga-remanescente-de-estagio-curricular-curso-tecnico-em-informatica-integrado-ao-ensino-medio/,2026-05-27,13:33,1,"O DIRETOR-GERAL DO INSTITUTO FEDERAL DE EDUCAÇÃO, CIÊNCIA E TECNOLOGIA BAIANO – Campus Senhor do Bonfim, no uso de suas atribuições legais delegadas pela Portaria nº. 304, de 19/03/2026, publicada no ...",
Senhor do Bonfim,Processo Eleitoral para escolha dos membros do Grêmio Estudantil do IF Baiano &#8211; Campus Senhor do Bonfim,https://www.ifbaiano.edu.br/unidades/bonfim/2026/05/18/processo-eleitoral-para-escolha-dos-membros-do-gremio-estudantil-do-if-baiano-campus-senhor-do-bonfim/,2026-05-18,22:06,1,,
Senhor do Bonfim,Processo Seletivo Simplificado para Contratação de Professor Substituto – Sociologia,https://www.ifbaiano.edu.br/unidades/bonfim/2026/05/18/processo-seletivo-simplificado-para-contratacao-de-professor-substituto-sociologia/,2026-05-18,18:51,1,"O SUBSTITUTO DO REITOR DO INSTITUTO FEDERAL DE EDUCAÇÃO, CIÊNCIA E TECNOLOGIA BAIANO, nouso das suas atribuições delegadas pela Portaria de Pessoal nº 75, de 27/01/2026, publicada no DOU de02/02/2026,...",
Senhor do Bonfim,Processo Seletivo Simplificado para Contratação de Professor Substituto – Pedagogia,https://www.ifbaiano.edu.br/unidades/bonfim/2026/05/18/processo-seletivo-simplificado-para-contratacao-de-professor-substituto-pedagogia/,2026-05-18,18:48,1,"O SUBSTITUTO DO REITOR DO INSTITUTO FEDERAL DE EDUCAÇÃO, CIÊNCIA E TECNOLOGIA BAIANO, nouso das suas atribuições delegadas pela Portaria de Pessoal nº 75, de 27/01/2026, publicada no DOU de02/02/2026,...",
Senhor do Bonfim,Ações do Centro de Línguas &#8211; Campus Senhor do Bonfim,https://www.ifbaiano.edu.br/unidades/bonfim/2026/05/14/acoes-do-centro-de-linguas-campus-senhor-do-bonfim/,2026-05-14,07:03,1,"No dia 06 de maio de 2026, o Centro de Línguas, com as articulações das Professorasde inglês, Cristiane Cruz e Aldenice Cardoso, possibilitaram que19 estudantes participassem na Olimpíada Brasileira d...",https://www.ifbaiano.edu.br/unidades/bonfim/files/2026/05/2901-Conversacao-em-Ingles-2.webp
Senhor do Bonfim,Campus Senhor do Bonfim convida Comunidade Acadêmica para Oficina &#8220;Normas da ABNT na Produção Científica&#8221;,https://www.ifbaiano.edu.br/unidades/bonfim/2026/05/12/campus-senhor-do-bonfim-convida-comunidade-academica-para-oficina-normas-da-abnt-na-producao-cientifica/,2026-05-12,21:41,1,O evento é promovido pelo Colegiado da Licenciatura em Química em parceria com a Biblioteca local e os outros colegiados dos cursos superiores do IF Baiano.,https://www.ifbaiano.edu.br/unidades/bonfim/files/2026/05/2324-Oficina-de-Normas-da-Abnt.webp
Senhor do Bonfim,IF Baiano &#8211; Campus Senhor do Bonfim Comemora Dia do Zootecnista em 13 de Maio. Inscrições no Suap via QR Code,https://www.ifbaiano.edu.br/unidades/bonfim/2026/05/09/if-baiano-campus-senhor-do-bonfim-comemora-dia-do-zootecnista-em-13-de-maio/,2026-05-09,01:34,1,"No próximo dia 13, o IF Baiano – Campus Senhor do Bonfim promoverá uma comemoração em alusão ao Dia do Zootecnista. A programação terá início às 8h, no Auditório do Pavilhão Pedagógico.O evento visa p...",https://www.ifbaiano.edu.br/unidades/bonfim/files/2026/05/0530-INSCRICAO-DO-EVENTO-QR-2.webp
Senhor do Bonfim,Processo Seletivo Simplificado para Contratação de Professor Substituto &#8211; Campus Senhor do Bonfim,https://www.ifbaiano.edu.br/unidades/bonfim/2026/05/08/processo-seletivo-simplificado-para-contratacao-de-professor-substitutocampus-senhor-do-bonfim/,2026-05-08,18:44,1,"O SUBSTITUTO DO REITOR DO INSTITUTO FEDERAL DE EDUCAÇÃO, CIÊNCIA E TECNOLOGIA BAIANO, no uso das suas atribuições delegadas pela Portaria de Pessoal nº 75, de 27/01/2026, publicada no DOU de 02/02/202...",
Senhor do Bonfim,SISU 2026 (8° Lista de Espera),https://www.ifbaiano.edu.br/unidades/bonfim/2026/05/07/sisu-2026-8-lista-de-espera/,2026-05-07,14:30,1,8° Edital de Chamada da Lista de Espera,
Senhor do Bonfim,SISU 2026 (7° CHAMADA DA LISTA DE ESPERA),https://www.ifbaiano.edu.br/unidades/bonfim/2026/04/27/sisu-2026-7-chamada-da-lista-de-espera/,2026-04-27,21:04,1,,
Senhor do Bonfim,"EDITAL DE REOPÇÃO DE CURSO, TRANSFERÊNCIA INTERNA E EXTERNA, MATRÍCULA ESPECIAL,INGRESSO COMO PORTADOR DE DIPLOMA E REINTEGRAÇÃO PARA O SEMESTRE 2026.1 DE LCA/LCC",https://www.ifbaiano.edu.br/unidades/bonfim/2026/04/23/edital-de-reopcao-de-curso-transferencia-interna-e-externa-matricula-especialingresso-como-portador-de-diploma-e-reintegracao-para-o-semestre-2026-1-de-lca-lcc/,2026-04-23,18:29,1,"O DIRETOR-GERAL DO INSTITUTO FEDERAL DE EDUCAÇÃO, CIÊNCIA E TECNOLOGIA BAIANO – CAMPUSSENHOR DO BONFIM, no uso de suas atribuições legais conferidas pela Portaria de Pessoal n° 304 de 19/03/26, public...",
Senhor do Bonfim,Novos Editais dos Programas de Assistência Estudantil PAE e PROPAC  Publicados.,https://www.ifbaiano.edu.br/unidades/bonfim/2026/04/17/novos-editais-dos-programas-de-assistencia-estudantil-pae-e-propac-foram-publicados/,2026-04-17,19:41,1,,
Senhor do Bonfim,Seleção de Estágio Curricular para estudantes dos cursos Técnico Integrado e Subsequente,https://www.ifbaiano.edu.br/unidades/bonfim/2026/04/07/selecao-de-estagio-curricular-para-estudantes-dos-cursos-tecnico-integrado-e-subsequente/,2026-04-07,20:02,1,"Serão ofertadas 20 (vinte) vagas para alunos matriculados nos Cursos Técnico em Agroindústria,Agropecuária e Informática Integrado ao Ensino Médio e para os alunos matriculados nos CursosTécnico em Al...",
Senhor do Bonfim,IF Baiano &#8211; Campus Senhor do Bonfim abre inscrições para estágio remunerado de nível Superior: de 12 a 24 de abril,https://www.ifbaiano.edu.br/unidades/bonfim/2026/04/06/if-baiano-campus-senhor-do-bonfim-abre-inscricoes-para-estagio-remunerado-de-nivel-superior-de-11-a-24-de-abril/,2026-04-06,21:17,1,"A oportunidade de estágio é para estudantes a partir do 3º semestre dos cursos de Licenciatura em Química, Ciências da Computação, Ciências Agrárias, Matemática, Pedagogia e Bacharelado em Administraç...",
Senhor do Bonfim,Homologação de Inscrições para bolsistas do Projeto Supera,https://www.ifbaiano.edu.br/unidades/bonfim/2026/03/31/homologacao-de-inscricoes-para-bolsistas-do-projeto-supera/,2026-03-31,20:24,1,Clique no link a seguir para conferir: LISTA_DE_INSCRIÇÕES HOMOLOGADAS,
Senhor do Bonfim,Campus Senhor do Bonfim realiza formatura da 2ª turma do curso Salgadeiras do Programa Mulheres Mil,https://www.ifbaiano.edu.br/unidades/bonfim/2026/03/24/campus-senhor-do-bonfim-realiza-formatura-da-2a-turma-do-curso-salgadeiras-do-programa-mulheres-mil/,2026-03-24,21:57,1,"A Formatura das alunas da 2ª turma do curso FIC Salgadeiras do Programa Mulheres Mil aconteceu na noite de 23/03, no auditório do Campus Senhor do Bonfim.",https://www.ifbaiano.edu.br/unidades/bonfim/files/2026/03/2140-DSC_0554-editada.webp
Senhor do Bonfim,Pregão Eletrônico nº 1 90000/2026 – Contratação de empresa de fornecimento de gás liquefeito de petróleo (GLP),https://www.ifbaiano.edu.br/unidades/bonfim/2026/03/20/pregao-eletronico-no-1-90000-2026-contratacao-de-empresa-de-fornecimento-de-gas-liquefeito-de-petroleo-glp/,2026-03-20,09:34,1,,
Senhor do Bonfim,"Chamada: Dispensa Eletrônica para contratação de empresa para fornecer água mineral natural sem gás para o IF Baiano, campus Senhor do Bonfim.",https://www.ifbaiano.edu.br/unidades/bonfim/2026/02/25/chamada-dispensa-eletronica-para-contratacao-de-empresa-para-fornecer-agua-mineral-natural-sem-gas-para-o-if-baiano-campus-senhor-do-bonfim/,2026-02-25,13:24,1,,
Senhor do Bonfim,Publicado Processo Seletivo para Residência Estudantil 2026,https://www.ifbaiano.edu.br/unidades/bonfim/2026/02/24/publicado-processo-seletivo-para-residencia-estudantil-2026/,2026-02-24,08:58,1,"O DIRETOR GERAL DO INSTITUTO FEDERAL DE EDUCAÇÃO, CIÊNCIA E TECNOLOGIA BAIANO &#8211; IF BAIANO CAMPUS SENHOR DO BONFIM, no uso de suas atribuições delegadas pela Portaria nº 283, de 18/03/2022, publi...",
Senhor do Bonfim,Pregão Eletrônico nº 90005/2025 &#8211; aquisição de livros para o acervo da Biblioteca do Campus Senhor do Bonfim,https://www.ifbaiano.edu.br/unidades/bonfim/2026/02/23/pregao-eletronico-no-90005-2025-aquisicao-de-livros-para-o-acervo-da-biblioteca-do-campus-senhor-do-bonfim/,2026-02-23,19:37,1,"O objeto da presente licitação é aquisição de livros para o acervo da Biblioteca do Instituto Federal de Educação, Ciência e Tecnologia Baiano &#8211; Campus Senhor do Bonfim, conforme condições, quan...",
Senhor do Bonfim,Sisu 2026: Convocação de 1ª Chamada da Lista de Espera e Resultado Preliminar da Banca de Heteroidentificação,https://www.ifbaiano.edu.br/unidades/bonfim/2026/02/19/sisu-2026-convocacao-de-1a-chamada-da-lista-de-espera-e-resultado-preliminar-da-banca-de-heteroidentificacao/,2026-02-19,22:56,1,"Para ter acesso ao site oficial do Sisu 2026 do IF Baiano &#8211; Campus Senhor do Bonfim, clique AQUI!",
Senhor do Bonfim,"Vagas Remanescentes para Cursos Técnicos Subsequentes Presenciais: Agrimensura (29), Alimentos (15), Informática (28). Inscrição/matrícula de 14 a 19 de fevereiro",https://www.ifbaiano.edu.br/unidades/bonfim/2026/02/11/vagas-remanescentes-para-cursos-tecnicos-subsequentes-presenciais-agrimensura-29-alimentos-15-informatica-28-inscricao-matricula-de-14-a-19-de-fevereiro/,2026-02-11,21:57,1,Inscrição/Matrícula será por meio de manifestação de interesse do candidato enviado via e-mail.,
Senhor do Bonfim,Sisu 2026: Convocação para Banca de Heteroidentificação &#8211; Candidatos da Chamada Regular,https://www.ifbaiano.edu.br/unidades/bonfim/2026/02/09/sisu-2026-convocacao-para-banca-de-heteroidentificacao-candidatos-da-chamada-regular/,2026-02-09,21:33,1,"Saiu hoje (09/02), a lista dos convocados para a Banca de Heteroidentificação referente à Chamada Regular.",
Senhor do Bonfim,IF Baiano &#8211; Campus Senhor do Bonfim abre inscrições de vagas remanescentes para os cursos Técnicos Subsequentes na modalidade EaD,https://www.ifbaiano.edu.br/unidades/bonfim/2026/02/06/if-baiano-campus-senhor-do-bonfim-abre-inscricoes-de-vagas-remanescentes-para-os-cursos-tecnicos-subsequentes-na-modalidade-ead/,2026-02-06,19:47,1,"O processo seletivo de vagas remanescentes para os cursos Técnicos Subsequentes na modalidade de Educação a Distância é por meio de manifestação de Interesse dos candidatos, com disponibilidade de vag...",
Senhor do Bonfim,CHAMADA Nº 03 SELEÇÃO DE BOLSISTAS E VOLUNTÁRIOS(AS) PARA O PROGRAMA DE EDUCAÇÃO TUTORIAL-PET EDUCAÇÃO MIDIÁTICA AGROECOLOGIA E COMPUTAÇÃO.,https://www.ifbaiano.edu.br/unidades/bonfim/2026/02/03/chamada-no-03-selecao-de-bolsistas-e-voluntariosas-para-o-programa-de-educacao-tutorial-pet-educacao-midiatica-agroecologia-e-computacao/,2026-02-03,15:07,1,"A DIRETORA-GERAL SUBSTITUTA DO INSTITUTO FEDERAL DE EDUCAÇÃO, CIÊNCIA E TECNOLOGIA BAIANO – CAMPUS SENHOR DO BONFIM, no uso de suas atribuições legais conferidas pela Portaria nº 423, de 25/03/2022, p...",
Senhor do Bonfim,ATENÇÃO! Cursos Técnicos Subsequentes: Edital de Matrícula Retificado com novas datas &#8211; 28/01 a 01/02,https://www.ifbaiano.edu.br/unidades/bonfim/2026/01/28/atencao-cursos-tecnicos-subsequentes-edital-de-matricula-retificado-com-novas-datas-28-01-a-01-02/,2026-01-28,13:21,1,,
Senhor do Bonfim,Aula Inaugural da 2ª Turma do Curso de Salgadeira do Programa Mulheres Mil,https://www.ifbaiano.edu.br/unidades/bonfim/2026/01/21/aula-inaugural-da-2a-turma-do-curso-de-salgadeira-do-programa-mulheres-mil/,2026-01-21,13:25,1,"Na noite de 19 de janeiro, aconteceu a aula inaugural da 2ª turma do curso de Salgadeira, no auditório do IF Baiano &#8211; Campus Senhor do Bonfim.",https://www.ifbaiano.edu.br/unidades/bonfim/files/2026/01/3434-DSC_0599.webp
Senhor do Bonfim,SISU 2026 &#8211; Ingresso de Estudantes no Ensino Superior,https://www.ifbaiano.edu.br/unidades/bonfim/2026/01/20/sisu-2026-ingresso-de-estudantes-no-ensino-superior/,2026-01-20,13:10,1,"Para acessar o site de Ingresso de Estudantes do SISU 2026, clique aqui",https://www.ifbaiano.edu.br/unidades/bonfim/files/2026/01/5657-SISU-2026-banner.webp
Senhor do Bonfim,Convocação 1ª Chamada cursos Técnicos Subsequentes EaD,https://www.ifbaiano.edu.br/unidades/bonfim/2026/01/16/convocacao-1a-chamada-cursos-tecnicos-subsequentes-ead/,2026-01-16,13:01,1,Para acessar a página clique AQUI.,
Senhor do Bonfim,Atenção! Calendário de Matrículas para curso Técnicos Integrados e Subsequentes Presenciais e EaD,https://www.ifbaiano.edu.br/unidades/bonfim/2026/01/12/atencao-calendario-de-matriculas-para-curso-tecnicos-integrados-e-subsequentes-presenciais-e-ead/,2026-01-12,09:59,1,Atenção Candidatos Aprovados para o  Processo Seletivo de Estudantes (Prosel 2026).,https://www.ifbaiano.edu.br/unidades/bonfim/files/2026/01/1722-41.webp
Senhor do Bonfim,Matrícula de 1ª Chamada e Lista de Espera para cursos Superiores em Administração e Licenciatura em Química,https://www.ifbaiano.edu.br/unidades/bonfim/2025/12/29/matricula-de-1a-chamada-e-lista-de-espera-para-cursos-superiores-em-administracao-e-licenciatura-em-quimica/,2025-12-29,13:36,1,Acesse a 1ª Chamada e Lista de Espera no Edital abaixo:,
Senhor do Bonfim,Programa Mulheres Mil &#8211; Seleção de Candidatas para o Curso de Formação Inicial em Salgadeira na Modalidade Presencial: Lista de Inscrições Homologadas!,https://www.ifbaiano.edu.br/unidades/bonfim/2025/12/22/programa-mulheres-mil-processo-de-inscricao-e-selecao-de-bolsa-formacao-para-candidatas-ao-curso-deformacao-inicial-formacao-em-salgadeira-modalidade-presencial/,2025-12-22,08:46,1,,https://www.ifbaiano.edu.br/unidades/bonfim/files/2025/03/2639-Producao-e-processamento-de-geleias.webp
Senhor do Bonfim,ATENÇÃO!! Candidatos dos Cursos EAD,https://www.ifbaiano.edu.br/unidades/bonfim/2025/12/17/atencao-candidatos-dos-cursos-ead/,2025-12-17,14:49,1,,
Senhor do Bonfim,ATENÇÃO!! Candidatos dos Cursos Presenciais Integrados e Subsequentes: Pré-Matrículas e Matrículas,https://www.ifbaiano.edu.br/unidades/bonfim/2025/12/17/atencao-candidatos-dos-cursos-integrados-e-subsequentes/,2025-12-17,14:46,1,"ATENÇÃO: A pré-matrícula serve como confirmação da cota pretendida. Não realizando essa ação, o candidato será deslocado para a concorrência geral, podendo assim sair da lista de aprovados e ir para a...",
Senhor do Bonfim,Calendário de Pré-Matrícula e Matrícula dos Cursos Técnicos Integrado e Subsequente,https://www.ifbaiano.edu.br/unidades/bonfim/2025/12/16/calendario-de-matricula-dos-cursos-tecnicos-integrado-e-subsequente/,2025-12-16,18:55,1,,https://www.ifbaiano.edu.br/unidades/bonfim/files/2025/12/9663-IMG-20251216-WA0015.webp
Senhor do Bonfim,Processo Seletivo para Monitorias Remunerada e Voluntária: 2ª Retificação do Edital nº 64/2025,https://www.ifbaiano.edu.br/unidades/bonfim/2025/12/09/processo-seletivo-para-monitorias-remunerada-e-voluntaria-homologacao-de-inscricoes/,2025-12-09,20:03,1,,
Senhor do Bonfim,Nota sobre divulgação do resultado final PROSEL Integrado 2026,https://www.ifbaiano.edu.br/unidades/bonfim/2025/12/05/nota-sobre-divulgacao-do-resultado-final-prosel-integrado-2026/,2025-12-05,21:02,1,"Por motivo de força maior, a publicação do resultado final Edital N° 54 de 27 de agosto de 2025, Cursos Integrados, previsto para o dia 05/12, ocorrerá em nova data a ser publicada no site do Campus.",
Senhor do Bonfim,Resultado Preliminar dos Cursos Integrados &#8211; Ingresso 2026,https://www.ifbaiano.edu.br/unidades/bonfim/2025/12/03/resultado-preliminar-dos-cursos-integrados-ingresso-2026/,2025-12-03,08:01,1,,
Senhor do Bonfim,Edital 66.2025 &#8211; Convocação para Prova Escrita Cursos Superiores em Administração (bacharelado) e Licenciatura em Química &#8211; Ingresso em 2026.1,https://www.ifbaiano.edu.br/unidades/bonfim/2025/12/02/edital-66-2025-convocacao-para-prova-escrita-cursos-superiores-em-administracao-bacharelado-e-licenciatura-em-quimica-ingresso-em-2026-1/,2025-12-02,18:49,1,,
Senhor do Bonfim,Aviso aos Candidatos dos Cursos Subsequentes EAD,https://www.ifbaiano.edu.br/unidades/bonfim/2025/12/01/aviso-aos-candidatos-dos-cursos-subsequentes-ead/,2025-12-01,15:34,1,,
Senhor do Bonfim,O genocídio do Negro no Brasil: lutas e resistência é o tema do VIII Novembro Negro no Campus Senhor do Bonfim &#8211; 24 a 27 de novembro,https://www.ifbaiano.edu.br/unidades/bonfim/2025/11/24/o-genocidio-do-negro-no-brasil-lutas-e-resistencia-e-o-tema-do-vii-novembro-negro-no-campus-senhor-do-bonfim-de-24-a-27-de-novembro/,2025-11-24,11:38,1,"Em comemoração ao Dia da Consciência Negra, o IF Baiano &#8211; Campus Senhor do Bonfim realizará de 24 a 27 de novembro o VIII Novembro Negro com a temática “O genocídio do Negro no Brasil: lutas e r...",https://www.ifbaiano.edu.br/unidades/bonfim/files/2025/11/3202-VIII-NOVEMBRO-NEGRO-CAMPUS-SENHOR-DO-BONFIM.webp
Senhor do Bonfim,Processo Seletivo para Monitorias Remunerada e Voluntária &#8211; Vagas para Ensinos Médio e Superior. Inscrições de 26/11 a 07/12,https://www.ifbaiano.edu.br/unidades/bonfim/2025/11/21/processo-seletivo-para-monitorias-remunerada-e-voluntaria-vagas-para-ensinos-medio-e-superior-inscricoes-de-26-11-a-07-12/,2025-11-21,23:38,1,,
Senhor do Bonfim,3ª Retificação do Edital nº 56 &#8211; Inscrições para cursos de graduação em Administração e Química,https://www.ifbaiano.edu.br/unidades/bonfim/2025/11/14/2a-retificacao-do-edital-no-56-inscricoes-para-cursos-de-graduacao-em-administracao-e-quimica/,2025-11-14,21:12,1,"Para acessar o link, clique Aqui",
Senhor do Bonfim,"Resultado Parcial do Edital de Reopção de Curso, Transferência Interna e Externa, Matrícula Especial, Ingresso como Portador de Diploma e Reintegração para o Semestre 2025.1 &#8211; Cursos de Licenciaturas em Ciências Agrárias e Ciências da Computação",https://www.ifbaiano.edu.br/unidades/bonfim/2025/11/07/edital-de-reopcao-de-curso-transferencia-interna-e-externa-matricula-especialingresso-como-portador-de-diploma-e-reintegracao-para-o-semestre-2025-1-de-lca-lcc/,2025-11-07,18:43,1,"O DIRETOR-GERAL DO INSTITUTO FEDERAL DE EDUCAÇÃO, CIÊNCIA E TECNOLOGIA BAIANO – CAMPUSSENHOR DO BONFIM, no uso de suas atribuições legais conferidas pela Portaria de Pessoal n° 283 de18/03/2022, publi...",
Senhor do Bonfim,Pregão Eletrônico nº 7/2025 &#8211; aquisição de instrumentos musicais e equipamentos de som para o Campus Senhor do Bonfim,https://www.ifbaiano.edu.br/unidades/bonfim/2025/11/06/pregao-eletronico-no-7-2025-aquisicao-de-instrumentos-musicais-e-equipamentos-de-som-para-o-campus-senhor-do-bonfim/,2025-11-06,20:09,1,"O objeto da presente licitação é aquisição de instrumentos musicais e equipamentos de som para o Instituto Federal de Educação, Ciência e Tecnologia Baiano &#8211; Campus Senhor do Bonfim conforme con...",
Senhor do Bonfim,Processo Seletivo para cursos Técnicos subsequentes ao Ensino Médio: 2ª retificação do Edital nº 53/2025,https://www.ifbaiano.edu.br/unidades/bonfim/2025/11/04/processo-seletivo-para-cursos-tecnicos-subsequentes-ao-ensino-medio-2a-retificacao-do-edital-no-53-2025/,2025-11-04,22:08,1,,
Senhor do Bonfim,Homologação de Inscrições para Professor Formador do curso de Salgadeiras do Programa Mulheres Mil,https://www.ifbaiano.edu.br/unidades/bonfim/2025/10/31/processo-seletivo-para-preenchimento-de-vagas-remanescentes-para-professor-formador-do-programa-mulheres-mil-referente-ao-curso-de-formacao-inicial-e-continuada-fic-em-salgadeiras/,2025-10-31,16:01,1,Apresentação,
