campus,titulo,link,data,hora,tempo_leitura,resumo,imagem
Itapetinga,Processo Seletivo de Estudantes para Vagas Remanescentes dos Cursos de graduação,https://www.ifbaiano.edu.br/unidades/itapetinga/2026/07/20/processo-seletivo-de-estudantes-para-vagas-remanescentes-dos-cursos-de-graduacao/,2026-07-20,20:14,1,"O Instituto Federal Baiano (IF Baiano), campus Itapetinga, publicou o Edital nº 09, de 20 de julho de 2026, que regulamenta a Seleção Simplificada para o preenchimento de vagas remanescentes nos curso...",
Itapetinga,Manual de Procedimento Simplificado de Apuração e Regularização Patrimonial,https://www.ifbaiano.edu.br/unidades/itapetinga/2026/07/16/manual-de-procedimento-simplificado-de-apuracao-e-regularizacao-patrimonial/,2026-07-16,10:34,1,"Em atendimento as normativas vigentes e a recomendação da Pró-Reitoria de Administração e Planejamento – PROPLAN, divulgamos o Manual de Procedimento Simplificado de Apuração e Regularização Patrimoni...",
Itapetinga,"Reunião do Comitê da Biosfera da Caatinga e Mesa Temática: Biodiversidade, Potencial Produtivo e Vulnerabilidade no entorno do Ecótono Caatinga e Mata Atlântica",https://www.ifbaiano.edu.br/unidades/itapetinga/2026/06/29/reuniao-do-comite-da-biosfera-da-caatinga-e-mesa-tematica-biodiversidade-potencial-produtivo-e-vulnerabilidade-no-entorno-do-ecotono-caatinga-e-mata-atlantica/,2026-06-29,13:48,1,,https://www.ifbaiano.edu.br/unidades/itapetinga/files/2026/06/9936-Evento-thumb.webp
Itapetinga,Resultado Final da Seleção de Estagiários do Edital N.º09 de 14 de Maio de 2026,https://www.ifbaiano.edu.br/unidades/itapetinga/2026/06/19/resultado-final-da-selecao-de-estagiarios-do-edital-n-o09-de-14-de-maio-de-2026/,2026-06-19,17:17,1,"A Comissão responsável pela realização de Processos Seletivos Simplificados para a contratação de estagiários (as), no âmbito do Instituto Federal Baiano &#8211; Campus Itapetinga, constituída pela Po...",https://www.ifbaiano.edu.br/unidades/itapetinga/files/2026/05/5195-SELECAO-DE-ESTAGVIARIOS-1.webp
Itapetinga,Segunda Retificação do Cronograma da Seleção de Estagiários do Edital N.º09 de 14 de Maio de 2026,https://www.ifbaiano.edu.br/unidades/itapetinga/2026/06/19/segunda-retificacao-do-cronograma-da-selecao-de-estagiarios-do-edital-n-o09-de-14-de-maio-de-2026/,2026-06-19,11:22,1,"A Comissão responsável pela realização de Processos Seletivos Simplificados para a contratação de estagiários (as), no âmbito do Instituto Federal Baiano &#8211; Campus Itapetinga, constituída pela Po...",
Itapetinga,Resultado da Interposição de Recurso ao Resultado Preliminar da Banca de Heteroidentificação da Seleção de Estagiários do Edital N.º09 de 14 de Maio de 2026,https://www.ifbaiano.edu.br/unidades/itapetinga/2026/06/19/resultado-da-interposicao-de-recurso-ao-resultado-preliminar-da-banca-de-heteroidentificacao-da-selecao-de-estagiarios-do-edital-n-o09-de-14-de-maio-de-2026/,2026-06-19,10:38,1,"A Comissão responsável pela realização de Processos Seletivos Simplificados para a contratação de estagiários (as), no âmbito do Instituto Federal Baiano &#8211; Campus Itapetinga, constituída pela Po...",
Itapetinga,Resultado Preliminar da Banca de Heteroidentificação da Seleção de Estagiários do Edital N.º09 de 14 de Maio de 2026,https://www.ifbaiano.edu.br/unidades/itapetinga/2026/06/16/resultado-preliminar-da-banca-de-heteroidentificacao-da-selecao-de-estagiarios-do-edital-n-o09-de-14-de-maio-de-2026/,2026-06-16,09:15,1,"A Comissão responsável pela realização de Processos Seletivos Simplificados para a contratação de estagiários (as), no âmbito do Instituto Federal Baiano &#8211; Campus Itapetinga, constituída pela Po...",https://www.ifbaiano.edu.br/unidades/itapetinga/files/2026/05/5195-SELECAO-DE-ESTAGVIARIOS-1.webp
Itapetinga,Retificação do Edital de convocação para a Banca de Heteroidentificação da Seleção de Estagiários do Edital N.º09 de 14 de Maio de 2026,https://www.ifbaiano.edu.br/unidades/itapetinga/2026/06/11/edital-de-convocacao-para-a-banca-de-heteroidentificacao-da-selecao-de-estagiarios-do-edital-n-o09-de-14-de-maio-de-2026/,2026-06-11,15:28,1,"Os(as) candidatos(as) abaixo relacionados(as) deverão comparecer presencialmente ao Instituto Federal de Educação, Ciência e Tecnologia &#8211; IF Baiano, Campus Itapetinga, no dia e horário indicados...",
Itapetinga,Resultado da Interposição de Recursos e Resultado Final das Entrevistas e Análise Curricular da Seleção de Estagiários do Edital N.º09 de 14 de Maio de 2026,https://www.ifbaiano.edu.br/unidades/itapetinga/2026/06/10/resultado-final-das-entrevistas-e-analise-curricular-da-selecao-de-estagiarios-do-edital-n-o09-de-14-de-maio-de-2026/,2026-06-10,16:20,1,"A Comissão responsável pela realização de Processos Seletivos Simplificados para a contratação de estagiários (as), no âmbito do Instituto Federal Baiano – Campus Itapetinga, constituída pela Portaria...",https://www.ifbaiano.edu.br/unidades/itapetinga/files/2026/05/5195-SELECAO-DE-ESTAGVIARIOS-1.webp
Itapetinga,Resultado Preliminar das Entrevistas e Análise Curricular da Seleção de Estagiários do Edital N.º09 de 14 de Maio de 2026,https://www.ifbaiano.edu.br/unidades/itapetinga/2026/06/08/resultado-preliminar-das-entrevistas-e-analise-curricular-da-selecao-de-estagiarios-do-edital-n-o09-de-14-de-maio-de-2026/,2026-06-08,17:05,1,"A Comissão responsável pela realização de Processos Seletivos Simplificados para a contratação de estagiários (as), no âmbito do Instituto Federal Baiano &#8211; Campus Itapetinga, constituída pela Po...",https://www.ifbaiano.edu.br/unidades/itapetinga/files/2026/05/5195-SELECAO-DE-ESTAGVIARIOS-1.webp
Itapetinga,Processo Seletivo para Contratação de Estagiários: Retificação do Cronograma,https://www.ifbaiano.edu.br/unidades/itapetinga/2026/06/08/processo-seletivo-para-contratacao-de-estagiarios-retificacao-do-cronograma/,2026-06-08,12:51,1,"O Instituto Federal Baiano, Campus Itapetinga, publicou a retificação do cronograma do Processo Seletivo Simplificado para formação de cadastro de reserva de estagiários(as), regido pelo Edital nº 09,...",
Itapetinga,Seleção de Estagiários: Convocação para Entrevistas,https://www.ifbaiano.edu.br/unidades/itapetinga/2026/05/29/selecao-de-estagiarios-convocacao-para-entrevistas/,2026-05-29,15:43,1,"O Instituto Federal Baiano, Campus Itapetinga, divulgou a convocação dos(as) candidatos(as) habilitados(as) para a etapa de entrevista e análise curricular do Processo Seletivo Simplificado para forma...",
Itapetinga,Processo Seletivo de Estagiários: Homologação das Inscrições,https://www.ifbaiano.edu.br/unidades/itapetinga/2026/05/28/45205/,2026-05-28,10:20,1,"O Instituto Federal Baiano, Campus Itapetinga, divulga o Resultado da Análise dos Recursos interpostos contra a Relação Preliminar de Inscrições do Processo Seletivo Simplificado para formação de cada...",
Itapetinga,Seleção de Estagiários: Relação Preliminar de Inscrições Homologadas,https://www.ifbaiano.edu.br/unidades/itapetinga/2026/05/25/selecao-de-estagiarios-relacao-preliminar-de-inscricoes-homologadas/,2026-05-25,19:39,1,"O Instituto Federal Baiano, Campus Itapetinga, divulgou a relação preliminar de inscrições homologadas do Processo Seletivo Simplificado para formação de cadastro de reserva de estagiários de níveis m...",
Itapetinga,IF Baiano na 54ª Exposição Agropecuária de Itapetinga: Programação Oficial,https://www.ifbaiano.edu.br/unidades/itapetinga/2026/05/18/if-baiano-na-54a-exposicao-agropecuaria-de-itapetinga-programacao-oficial/,2026-05-18,16:08,2,"O Instituto Federal Baiano já está com tudo pronto para marcar presença na 54ª Exposição Agropecuária de Itapetinga, um dos eventos mais tradicionais do município e da região. Entre os dias 20 e 23 de...",
Itapetinga,3ª Chamada para Matrícula da Lista de Espera do SISU,https://www.ifbaiano.edu.br/unidades/itapetinga/2026/05/18/sisu-2a-chamada-da-lista-de-espera-e-convocacao-dos-candidatosas-para-matricula/,2026-05-18,14:15,1,"O IF Baiano, Campus Itapetinga, informa aos(às) candidatos(as) convocados(as) na Terceira Chamada da Lista de Espera do Sisu 2026 que a matrícula deverá ser feita no dia 22 de maio de 2026, no horário...",
Itapetinga,Processo Seletivo de Estagiários de Níveis Médio e Superior,https://www.ifbaiano.edu.br/unidades/itapetinga/2026/05/14/processo-seletivo-de-estagiarios-de-niveis-medio-e-superior/,2026-05-14,14:46,1,"O Instituto Federal Baiano (IF Baiano) – Campus Itapetinga &#8211; publicou, nesta quinta-feira (14), o Edital nº 09/2026, que trata do processo seletivo para formação de cadastro de reserva de estagi...",
Itapetinga,Sisu 2026: Campus Itapetinga realiza matrículas de candidatos(as) da Lista de Espera,https://www.ifbaiano.edu.br/unidades/itapetinga/2026/05/12/sisu-2026-campus-itapetinga-realiza-matriculas-de-candidatosas-da-lista-de-espera/,2026-05-12,14:46,1,"O IF Baiano, Campus Itapetinga, informa aos(às) candidatos(as) convocados(as) na Lista de Espera do Sisu 2026 que o período de matrícula ocorrerá, de forma totalmente on-line, entre os dias 12 e 14 de...",
Itapetinga,Processo Seletivo para Contratação de Professores Substitutos de Geografia e Química,https://www.ifbaiano.edu.br/unidades/itapetinga/2026/05/12/processo-seletivo-para-contratacao-de-professores-substitutos-de-geografia-e-quimica/,2026-05-12,14:40,1,"O Instituto Federal Baiano (IF Baiano), Campus Itapetinga, publicou o Edital nº 96, de 08 de maio de 2026, referente ao Processo Seletivo Simplificado para contratação temporária de professores substi...",
Itapetinga,Resultado Final do PAISE,https://www.ifbaiano.edu.br/unidades/itapetinga/2026/04/22/resultado-final-no-paise/,2026-04-22,09:09,1,"O Instituto Federal Baiano, Campus Itapetinga, divulga o resultado final dos estudantes classificados no Programa de Assistência e Inclusão Social do Estudante (PAISE) 2026.1, conforme o Edital nº 05,...",
Itapetinga,Professor Rômulo toma posse como Diretor-Geral do Campus Itapetinga,https://www.ifbaiano.edu.br/unidades/itapetinga/2026/03/25/professor-romulo-sposito-das-virgens-toma-posse-como-diretor-geral-do-campus-itapetinga-para-a-gestao-2026-2030/,2026-03-25,11:05,1,"O Instituto Federal Baiano (IF Baiano) celebrou, na tarde da última segunda-feira (23), a posse dos(as) diretores(as)-gerais eleitos(as) para a gestão 2026–2030 dos 14 campi da instituição. A cerimôni...",
Itapetinga,IF Baiano convoca candidatos do Campus Itapetinga para banca de heteroidentificação do Partiu IF 2026,https://www.ifbaiano.edu.br/unidades/itapetinga/2026/03/24/if-baiano-convoca-candidatos-do-campus-itapetinga-para-banca-de-heteroidentificacao-do-partiu-if-2026/,2026-03-24,17:08,1,O Instituto Federal Baiano (IF Baiano) publicou a convocação dos candidatos inscritos no processo seletivo do Programa Partiu IF 2026 para participação na banca de heteroidentificação. A etapa é obrig...,
Itapetinga,Campus Itapetinga promove evento sobre drones nos dias 20 e 21 de março,https://www.ifbaiano.edu.br/unidades/itapetinga/2026/03/16/icampus-itapetinga-promove-evento-sobre-drones-nos-dias-20-e-21-de-marco/,2026-03-16,11:25,1,"O IF Baiano, Campus Itapetinga, realizará, nos dias 20 e 21 de março, o Evento de Drones – Curso de Montagem e Configuração de Drones, voltado para servidores e estudantes da instituição. A atividade ...",
Itapetinga,Chamada Pública para Aquisição de Alimentos da Agricultura Familiar,https://www.ifbaiano.edu.br/unidades/itapetinga/2026/03/10/chamada-publica-para-aquisicao-de-alimentos-da-agricultura-familiar/,2026-03-10,11:57,1,"O Instituto Federal Baiano (IF Baiano), Campus Itapetinga, lançou o Edital de Chamada Pública nº 01/2026 para aquisição de alimentos provenientes da Agricultura Familiar e do Empreendedor Familiar Rur...",
Itapetinga,Contratação de tradutor/intérprete de Libras,https://www.ifbaiano.edu.br/unidades/itapetinga/2026/03/10/aviso-de-licitacao-para-contratacao-de-tradutor-interprete-de-libras/,2026-03-10,11:19,1,"O Instituto Federal Baiano (IF Baiano), Campus Itapetinga, informa a abertura de aviso de licitação para a contratação de serviços de tradutor/intérprete de Língua Brasileira de Sinais (Libras) e Líng...",https://www.ifbaiano.edu.br/unidades/itapetinga/files/2026/03/2370-aviso-de-licitacao-imagem.webp
Itapetinga,Edital do PAISE para apoio a estudantes em vulnerabilidade socioeconômica,https://www.ifbaiano.edu.br/unidades/itapetinga/2026/03/05/edital-do-paise-para-apoio-a-estudantes-em-vulnerabilidade-socioeconomica/,2026-03-05,17:12,2,"A Direção Geral do IFBAIANO, Campus Itapetinga, publicou o Edital nº 5, de 4 de março de 2026, que regulamenta a seleção de estudantes para o Programa de Assistência e Inclusão Social do Estudante (PA...",
Itapetinga,Educação a Distância: Segunda Convocação para Matrícula,https://www.ifbaiano.edu.br/unidades/itapetinga/2026/03/04/educacao-a-distancia-segunda-convocacao-para-matricula/,2026-03-04,14:22,1,"O Instituto Federal de Educação, Ciência e Tecnologia Baiano – Campus Itapetinga &#8211; publicou a lista de segunda chamada do Processo Seletivo para o curso de Secretaria Escolar (EaD).",
Itapetinga,Prazo para Renovação de Matrículas dos Cursos Técnicos Integrados começa nesta sexta-feira (20/02/2026),https://www.ifbaiano.edu.br/unidades/itapetinga/2026/02/20/prazo-para-renovacao-de-matriculas-dos-cursos-tecnicos-integrados-comeca-nesta-sexta-feira-20-02-2026/,2026-02-20,09:04,1,"Os estudantes veteranos dos cursos técnicos integrados ao Ensino Médio em Agropecuária, Agroindústria e Meio Ambiente do IF Baiano, campus Itapetinga, devem realizar a renovação de matrícula entre os ...",
Itapetinga,Sexta chamada para matrícula dos Cursos Técnicos Integrados,https://www.ifbaiano.edu.br/unidades/itapetinga/2026/02/11/sexta-chamada-para-matricula-dos-cursos-tecnicos-integrados/,2026-02-11,19:24,1,"O Instituto Federal Baiano (IF Baiano), Campus Itapetinga, publicou a sexta chamada para matrícula do Processo Seletivo regido pelo Edital nº 11, de 01 de setembro de 2025, referente ao ingresso nos C...",
Itapetinga,Educação a distância: novo prazo de matrícula para curso técnico em Secretaria Escolar,https://www.ifbaiano.edu.br/unidades/itapetinga/2026/02/06/edital-de-matricula-para-curso-tecnico-subsequente-ead/,2026-02-06,10:11,1,"O Instituto Federal de Educação, Ciência e Tecnologia Baiano (IF Baiano), Campus Itapetinga, divulgou o Edital nº 04/2026, que trata da matrícula dos candidatos aprovados no Processo Seletivo 2026 par...",
Itapetinga,"Projeto aprovado pelo CNPQ engloba inovação, segurança alimentar e inclusão social no Médio Sudoeste Baiano",https://www.ifbaiano.edu.br/unidades/itapetinga/2026/02/04/inovacao-social-seguranca-alimentar-e-inclusao-no-medio-sudoeste-baiano/,2026-02-04,22:35,1,"O Instituto Federal de Educação, Ciência e Tecnologia Baiano (IF Baiano), Campus Itapetinga, teve aprovado pelo Conselho Nacional de Desenvolvimento Científico e Tecnológico (CNPq) o projeto “Rede de ...",https://www.ifbaiano.edu.br/unidades/itapetinga/files/2026/02/5317-CNPQ-PROJETO-APROVADO.webp
Itapetinga,Sexta chamada para matrícula nos cursos técnicos integrados,https://www.ifbaiano.edu.br/unidades/itapetinga/2026/02/02/quarta-chamada-para-matricula-nos-cursos-tecnicos-integrados/,2026-02-02,15:37,1,"O Instituto Federal Baiano (IF Baiano), Campus Itapetinga, publicou a quinta chamada de estudantes convocados para matrícula nos cursos técnicos integrados ao ensino médio.",
Itapetinga,Terceira chamada para matrícula nos cursos técnicos integrados,https://www.ifbaiano.edu.br/unidades/itapetinga/2026/01/13/edital-de-matricula-2026-cursos-tecnicos-integrados/,2026-01-13,11:47,1,"O Instituto Federal Baiano (IF Baiano), Campus Itapetinga, divulgou a terceira chamada de estudantes convocados para matrícula nos cursos técnicos integrados ao ensino médio.",https://www.ifbaiano.edu.br/unidades/itapetinga/files/2025/08/6870-VEM-SER.webp
Itapetinga,Parceria pela Educação: IF Baiano e Prefeitura de Potiraguá,https://www.ifbaiano.edu.br/unidades/itapetinga/2026/01/07/assinatura-de-act-polo-de-apoio-em-potiragua/,2026-01-07,10:01,1,É com entusiasmo que anunciamos a celebração do Acordo de Cooperação Técnica nº 01/2025 entre o IF Baiano &#8211; Campus Itapetinga e a Prefeitura Municipal de Potiraguá. Esta parceria estratégica vis...,https://www.ifbaiano.edu.br/unidades/itapetinga/files/2020/04/marca-if-baiano-campus-itapetinga-horizontal.png
Itapetinga,Resultado Final do Processo Seletivo dos Cursos Subsequentes de Educação a Distância,https://www.ifbaiano.edu.br/unidades/itapetinga/2025/12/12/resultado-preliminar-do-processo-seletivo-dos-cursos-subsequentes-de-educacao-a-distancia/,2025-12-12,15:27,1,"A Direção Geral do IF Baiano, Campus Itapetinga, publicou, nesta quarta-feira (17/12/2025), o Resultado Final do Processo Seletivo para ingresso de estudantes nos Cursos da Educação Profissional Técni...",
Itapetinga,Resultado Final do Processo Seletivo para Professor Substituto: Português/Espanhol,https://www.ifbaiano.edu.br/unidades/itapetinga/2025/12/11/resultado-final-do-processo-seletivo-para-professor-substituto-portugues-espanhol/,2025-12-11,11:19,1,"O Instituto Federal Baiano – Campus Itapetinga &#8211; divulgou, nesta quarta-feira, 11 de dezembro de 2025, o Resultado Final da Prova de Desempenho Didático e da Prova de Títulos referente ao Proces...",
Itapetinga,Resultado Final do Processo de Ingresso de Estudantes e Edital de Matrícula,https://www.ifbaiano.edu.br/unidades/itapetinga/2025/12/03/resultado-preliminar-geral-do-processo-de-ingresso-de-estudantes-ensino-medio/,2025-12-03,12:39,1,"O Instituto Federal Baiano – Campus Itapetinga &#8211; tornou público, nesta quarta-feira, 09 de dezembro de 2025, o Resultado Final do Processo Seletivo para Ingresso de Estudantes nos Cursos Técnico...",
Itapetinga,Professor Substituto de Português/Espanhol: Resultados Preliminares,https://www.ifbaiano.edu.br/unidades/itapetinga/2025/12/02/professor-substituto-de-portugues-espanhol-sorteio-da-ordem-de-apresentacao-e-dos-pontos-para-a-prova-didatica/,2025-12-02,15:07,1,A Comissão Responsável pelo Processo Seletivo Simplificado para Contratação de Professor substituto divulgou os resultados preliminares da prova didática e da prova de título.,
Itapetinga,Atividades do Novembro Negro continuam nesta sexta (28) e sábado (29) no Campus Itapetinga,https://www.ifbaiano.edu.br/unidades/itapetinga/2025/11/26/atividades-do-novembro-negro-comecam-nesta-quarta-26-11-no-campus-itapetinga/,2025-11-26,09:10,1,"O Instituto Federal Baiano – Campus Itapetinga &#8211; prossegue com as atividades da programação do Novembro Negro 2025, mês dedicado à reflexão, valorização e promoção da história e cultura afro-bra...",https://www.ifbaiano.edu.br/unidades/itapetinga/files/2025/11/8987-NOVEMBRO-NEGRO.webp
Itapetinga,Processo Seletivo dos Cursos EAD: Resultado Preliminar da Banca de Heteroindentificação,https://www.ifbaiano.edu.br/unidades/itapetinga/2025/11/12/processo-seletivo-dos-cursos-tecnicos-ead-retificacao-do-edital/,2025-11-12,10:00,1,"A Direção Geral do IFBAIANO, campus Itapetinga, publicou o resultado preliminar da banca de heteroidentiiação ético-racial, referente ao Processo Seletivo para ingresso de estudantes nos Cursos da Edu...",
Itapetinga,Ingresso de Estudantes: Resultado Definitivo da Banca de Heteroidentificação Étnico-racial,https://www.ifbaiano.edu.br/unidades/itapetinga/2025/11/05/processo-de-ingresso-de-estudantes-resultado-preliminar-da-analise-do-historico-escolar/,2025-11-05,15:55,1,O IF Baiano – Campus Itapetinga – divulgou o Resultado Definitivo da Banca de Heteroidentificação Étnico-Racial referente aos candidatos inscritos nas reservas de vagas para pretos e pardos do Process...,
Itapetinga,Ingresso de Estudantes nos Cursos Técnicos Integrados: Lista Definitiva de Inscrições,https://www.ifbaiano.edu.br/unidades/itapetinga/2025/10/31/ingresso-de-estudantes-nos-cursos-tecnicos-integrados-lista-definitiva-de-inscricoes/,2025-10-31,22:45,1,O Instituto Federal Baiano (IF Baiano) – Campus Itapetinga &#8211; torna pública a lista definitiva de inscrições homologadas do Processo Seletivo para Ingresso de Estudantes nos Cursos Técnicos Integ...,
Itapetinga,Ingresso de Estudantes nos Cursos Técnicos de Ensino Médio: 2ª Correção do Cronograma,https://www.ifbaiano.edu.br/unidades/itapetinga/2025/10/29/ingresso-de-estudantes-dos-cursos-de-ensino-medio-2a-correcao-do-cronograma/,2025-10-29,17:06,1,"O Instituto Federal Baiano (IF Baiano) – Campus Itapetinga &#8211; publicou a 2ª Retificação do Cronograma do Edital nº 11/2025, referente ao Processo Seletivo para ingresso de estudantes nos cursos d...",
Itapetinga,Contratação de Professor Substituto: Lista Preliminar de Inscrições Homologadas,https://www.ifbaiano.edu.br/unidades/itapetinga/2025/10/24/campus-itapetinga-abre-selecao-para-professor-substituto-na-area-de-portugues-espanhol/,2025-10-24,18:59,1,"O Instituto Federal Baiano (IF Baiano) – Campus Itapetinga &#8211; publicou a lista preliminar de inscrições homologadas referente ao Edital nº 228/2025, que regulamenta o Processo Seletivo Simplifica...",
Itapetinga,Ingresso de Estudantes: Lista Preliminar de Inscrições Homologadas,https://www.ifbaiano.edu.br/unidades/itapetinga/2025/10/24/ingresso-de-estudantes-lista-preliminar-de-inscricoes-homologadas/,2025-10-24,09:21,1,"O Instituto Federal Baiano (IF Baiano) – Campus Itapetinga &#8211; publicou, nesta sexta-feira (24), a lista preliminar de inscrições homologadas do Processo Seletivo para ingresso de estudantes nos C...",
Itapetinga,Apoio à participação de servidores em eventos científicos: resultado final,https://www.ifbaiano.edu.br/unidades/itapetinga/2025/10/23/edital-de-apoio-a-participacao-de-servidores-em-eventos-cientificos-e-tecnologicos/,2025-10-23,09:40,1,"O Instituto Federal Baiano (IF Baiano) – Campus Itapetinga &#8211; publicou o resultado final referente ao Edital nº 13/2025, que dispõe sobre o apoio à participação de servidores em eventos científic...",
Itapetinga,Campus Itapetinga abre inscrições para cursos técnicos subsequentes na modalidade EaD,https://www.ifbaiano.edu.br/unidades/itapetinga/2025/10/22/campus-itapetinga-abre-inscricoes-para-cursos-tecnicos-subsequentes-na-modalidade-ead/,2025-10-22,20:49,1,"O Instituto Federal Baiano (IF Baiano) – Campus Itapetinga &#8211; divulgou, nesta quarta-feira (22), o Edital nº 12/2025, que regulamenta o processo seletivo para ingresso de estudantes nos cursos té...",
Itapetinga,Projeto de Extensão &#8220;Forró no IF&#8221;,https://www.ifbaiano.edu.br/unidades/itapetinga/2025/10/14/projeto-de-extensao-forro-no-if/,2025-10-14,11:05,1,"O Instituto Federal Baiano – Campus Itapetinga &#8211; inicia, no próximo dia 29 de outubro (quarta-feira), às 19h, o Projeto de Extensão “Forró no IF”, uma iniciativa que busca promover saúde, lazer ...",
Itapetinga,Prorrogação do período de inscrições para cursos técnicos integrados ao Ensino Médio,https://www.ifbaiano.edu.br/unidades/itapetinga/2025/10/14/prorrogacao-do-periodo-de-inscricoes-para-cursos-tecnicos-integrados-ao-ensino-medio/,2025-10-14,10:46,1,O Instituto Federal Baiano (IF Baiano) – Campus Itapetinga &#8211; informa que o prazo para inscrições no Processo Seletivo de Estudantes 2026 foi prorrogado até o dia 19 de outubro de 2025. O certame...,
Itapetinga,Comissão Eleitoral 2026-2030,https://www.ifbaiano.edu.br/unidades/itapetinga/2025/10/03/44648/,2025-10-03,07:48,1,,https://www.ifbaiano.edu.br/unidades/itapetinga/files/2025/10/8526-Eleicao_Comissoes-Eleitorais.webp
